{
  "$schema": "http://json-schema.org/draft-07/schema#",
  "title": "FishboneThought",
  "type": "object",
  "required": [
    "mode",
    "effect",
    "categories"
  ],
  "properties": {
    "mode": {
      "const": "fishbone"
    },
    "effect": {
      "type": "string"
    },
    "categories": {
      "type": "array",
      "minItems": 1,
      "items": {
        "type": "object",
        "required": [
          "name",
          "causes"
        ],
        "properties": {
          "name": {
            "type": "string"
          },
          "causes": {
            "type": "array",
            "items": {
              "type": "string"
            }
          }
        },
        "additionalProperties": true
      }
    },
    "primaryCauses": {
      "type": "array",
      "items": {
        "type": "string"
      }
    }
  },
  "additionalProperties": false
}
